audio_name,artist,title,year,energy_truth,energy_ml,dance_truth,dance_ml,valence_truth,tempo_bpm,duration_sec,loudness_LUFS,energy_feature,danceability_feature,valence_feature,notes,energy_feature_band,danceability_feature_band,triage_tag_energy,triage_tag_dance
1976_the_eagles__hotel_california__album,Eagles,Hotel California,1976,mid,hi,lo,mid,mid,147.65625,391.5813151927438,-17.726708062511182,0.3692794499001425,0.3417721085501688,0.567711779960057,Classic rock epic; long-running structure; bittersweet mood.,mid,lo,truth_feat_agree_ml_diff,truth_feat_agree_ml_diff
1978_earth_wind_and_fire__september__album,"Earth, Wind & Fire",September,1978,hi,lo,hi,mid,hi,126.04801829268293,214.73814058956916,-18.318128579507036,0.3712140198021745,0.591923004783439,0.5684856079208698,Classic disco-funk; relentlessly upbeat and danceable archetypal hi-energy/hi-dance/hi-valence party cut.,mid,hi,all_disagree,truth_feat_agree_ml_diff
1979_bee_gees__stayin_alive__album,Bee Gees,Stayin' Alive,1979,hi,hi,hi,mid,mid,103.359375,282.3546485260771,-18.079004115344947,0.3864549965932998,0.6220117051000638,0.57458199863732,Signature 70s disco groove; relentless pulse very strong dance feel.,hi,hi,all_agree,truth_feat_agree_ml_diff
1982_toto__africa__album,Toto,Africa,1982,mid,lo,mid,lo,mid,92.28515625,291.2711111111111,-23.311160191446934,0.37353508013892023,0.4765386216729593,0.5694140320555681,Classic soft-rock/pop; steady groove not hyper or sleepy—very “true mid” on both energy and dance.,hi,mid,all_disagree,truth_feat_agree_ml_diff
1984_prince__when_doves_cry__album,Prince,When Doves Cry,1984,hi,lo,mid,lo,mid,126.04801829268293,351.4572335600907,-20.216903269268144,0.3856945838458942,0.4457593938427012,0.5742778335383577,Sparse experimental but huge mainstream hit.,hi,mid,truth_feat_agree_ml_diff,truth_feat_agree_ml_diff
1991_nirvana__smells_like_teen_spirit__single,Nirvana,Smells Like Teen Spirit,1991,hi,mid,mid,lo,mid,117.45383522727273,298.70149659863944,-18.3163279890769,0.36789601880722245,0.4157827668954618,0.5671584075228889,Grunge rock anthem; very high energy with mid danceability and brooding anthemic tone.,mid,mid,ml_feat_agree_truth_diff,truth_feat_agree_ml_diff
1992_boyz_ii_men__end_of_the_road__album,Boyz II Men,End of the Road,1992,mid,hi,lo,mid,lo,147.65625,349.2281179138322,-17.5563463301897,0.38530343057006133,0.2893565852512199,0.5741213722280245,Early-90s R&B slow jam; big vocal swells but overall slow sway-not-dance heartbreak-heavy.,hi,lo,ml_feat_agree_truth_diff,truth_feat_agree_ml_diff
1998_britney_spears__baby_one_more_time__album,Britney Spears,...Baby One More Time,1998,mid,mid,mid,hi,mid,92.28515625,210.27990929705214,-17.85331442723911,0.3802961819122644,0.42989818497240007,0.5721184727649058,Turn-of-era teen pop; strong hook mid-tempo.,hi,mid,truth_ml_agree_feat_diff,truth_feat_agree_ml_diff
2004_kelly_clarkson__since_u_been_gone__album,Kelly Clarkson,Since U Been Gone,2004,hi,lo,mid,hi,mid,132.51201923076923,188.73179138321996,-17.927289795371134,0.35841733844985624,0.3741571130839847,0.5633669353799424,Pop-rock belter; high energy breakup anthem.,lo,mid,ml_feat_agree_truth_diff,truth_feat_agree_ml_diff
2008_lady_gaga__pokerface__album,Lady Gaga,Poker Face,2008,hi,hi,hi,mid,mid,120.18531976744185,236.28625850340137,-18.060759004168254,0.354835968833679,0.5281335759905681,0.5619343875334716,Electro-pop banger; club-oriented energy.,lo,hi,truth_ml_agree_feat_diff,truth_feat_agree_ml_diff
2008_rihanna__disturbia__album,Rihanna,Disturbia,2008,hi,hi,hi,mid,lo,126.04801829268293,237.77233560090704,-18.139415375460718,0.36593976800709727,0.5194105415602142,0.5663759072028389,"Dark electro-pop club track; very high energy and danceability but eerie, tense low-valence feel.",mid,hi,truth_ml_agree_feat_diff,truth_feat_agree_ml_diff
2009_black_eyed_peas__i_gotta_feeling__album,Black Eyed Peas,I Gotta Feeling,2009,hi,hi,hi,mid,hi,129.19921875,289.78503401360547,-17.59350624424872,0.37837269481364605,0.5382936528374916,0.5713490779254584,Huge party anthem; very high energy and danceability; feel-good chorus.,hi,hi,all_agree,truth_feat_agree_ml_diff
2011_adele__someone_like_you__album,Adele,Someone Like You,2011,lo,hi,lo,hi,lo,135.99917763157896,285.3268027210884,-17.3139927881886,0.3412495325560102,0.34248461096122995,0.556499813022404,Piano/vocal breakup ballad; archetypal low energy very low danceability emotionally devastating.,lo,lo,truth_feat_agree_ml_diff,truth_feat_agree_ml_diff
2012_bruno_mars__when_i_was_your_man__album,Bruno Mars,When I Was Your Man,2012,mid,mid,lo,hi,lo,72.78829225352112,212.50902494331066,-17.65884470154171,0.3650572947904862,0.27961774053168587,0.5660229179161944,Piano ballad; sparse arrangement; emotionally regretful; non-dance.,mid,lo,all_agree,truth_feat_agree_ml_diff
2014_ariana_grande__one_last_time__album,Ariana Grande,One Last Time,2014,mid,hi,mid,hi,mid,126.04801829268293,196.1621768707483,-17.56748176578191,0.36221482696376744,0.4267804279310059,0.564885930785507,Mid-tempo EDM-pop ballad; big chorus but not a club banger sits comfortably in the middle.,mid,mid,truth_feat_agree_ml_diff,truth_feat_agree_ml_diff
2014_sam_smith__stay_with_me__album,Sam Smith,Stay With Me,2014,mid,mid,lo,hi,lo,84.72079918032787,171.64190476190475,-17.647530758828704,0.3399069583174197,0.2671226177743575,0.5559627833269678,Gospel-tinged ballad; slow emotional delivery; low danceability.,lo,lo,truth_ml_agree_feat_diff,truth_feat_agree_ml_diff
2014_sia__chandelier__album,Sia,Chandelier,2014,hi,lo,mid,lo,lo,114.84375,214.73814058956916,-18.79923346808762,0.35701271798294804,0.3817263869512473,0.5628050871931792,Soaring pop ballad over trap-influenced drums; vocally intense high energy but emotionally heavy with low-valence subject matter.,lo,mid,ml_feat_agree_truth_diff,truth_feat_agree_ml_diff
2014_taylor_swift__style__album,Taylor Swift,Style,2014,mid,hi,mid,hi,mid,95.703125,229.59891156462584,-17.869900345822522,0.3567734592281365,0.4870669841694838,0.5627093836912546,"Cool mid-tempo pop; driving but not a club banger, strong mid-band reference.",lo,mid,all_disagree,truth_feat_agree_ml_diff
2015_justin_bieber__love_yourself__album,Justin Bieber,Love Yourself,2015,lo,hi,mid,hi,mid,95.703125,232.57106575963718,-17.12202795872671,0.36508065834257863,0.42315259037503716,0.5660322633370314,Minimal acoustic pop; low energy and danceability with lightly snarky tone.,mid,mid,all_disagree,truth_feat_agree_ml_diff
2016_justin_timberlake__cant_stop_the_feeling__album,Justin Timberlake,CAN'T STOP THE FEELING!,2016,hi,hi,hi,mid,hi,112.34714673913044,235.54321995464852,-18.16900437091861,0.3662699922341684,0.540479303342583,0.5665079968936674,"Uplifting disco-funk pop; designed as a feel-good family dance track with clearly high energy, high danceability and high valence.",mid,hi,truth_ml_agree_feat_diff,truth_feat_agree_ml_diff
2016_the_chainsmokers_ft_halsey__closer__single,The Chainsmokers feat. Halsey,Closer,2016,mid,mid,mid,lo,mid,95.703125,244.45968253968255,-18.440503095090413,0.3726911683115069,0.3728568446020891,0.5690764673246027,EDM-pop with mellow energy; streaming-era staple.,mid,mid,all_agree,truth_feat_agree_ml_diff
2017_daniel_caesar_h_e_r__best_part__album,Daniel Caesar feat. H.E.R.,Best Part,2017,lo,lo,lo,hi,mid,143.5546875,209.53687074829932,-17.397813740434227,0.35408642255581574,0.21150807670692146,0.5616345690223263,Modern neo-soul slow jam; intimate super low energy and dance but warm/mid valence rather than tragic.,lo,lo,all_agree,truth_feat_agree_ml_diff
2018_marshmello_bastille__happier__single,Marshmello & Bastille,Happier,2018,mid,mid,mid,lo,lo,99.38401442307692,213.99510204081633,-18.06084242062632,0.3682704773125116,0.46272922642106684,0.5673081909250046,Sad-pop mid-tempo; bounce in the drums but emotional tone is clearly down strong “mid” energy with low-ish valence.,mid,mid,all_agree,truth_feat_agree_ml_diff
2018_post_malone__better_now__album,Post Malone,Better Now,2018,mid,hi,mid,hi,mid,97.50884433962264,231.0849886621315,-17.711648288057937,0.36635836339964944,0.42063845552032175,0.5665433453598597,Mid-tempo emo-rap pop; steady groove; bittersweet reflective tone.,mid,mid,truth_feat_agree_ml_diff,truth_feat_agree_ml_diff
